name,type,ProductServices
Fernandez-Collier,Company,"Construction machinery NC steel bending machines, high intension steel straightening cutting machines, CNC, railway non-standard equipment; railway locomotive and rolling stock parts, hinge beam of artificial diamond press and parts of railway, wind power, mine machines"
Fernandez-English,Company,Unknown
Fernandez-Hall,Company,Food products
Fernandez-Jackson,Company,Unknown
Fernandez-Williams,Company,"Leather shoes, rubber sports shoes, pumps, plastic footwear, casual and work shoes, sandals and flip flops, boots and other protective footwear"
Ferrell PLC,Company,Fish and fish products
"Ferrell, Lamb and Anderson",Company,Wide range of skin care and healthcare products
Fields Group,Company,Footwear
Fields Ltd,Company,Unknown
"Fields, Arellano and Cruz",Company,"Involved in crushing and oil extraction from soybeans, sunflower-seeds, and peanuts"
"Fields, Evans and Cooper",Company,"Producing and supplying a range of products, such as engineered flooring, embossed fancy plywood, and unfinished and UV bedboard panels (red oak, birch, and pine)"
"Fields, Holmes and Weber",Company,Zinc and aluminum die cast parts
Fields-Mcclain,Company,Unknown
Fields-Morgan,Company,Fish and fish products
Fields-Young,Company,Unknown
Figueroa and Sons,Company,"A range of oceanic aquatic products, oceanic bio-health food products, dairy products, and fruits and vegetables"
Figueroa LLC,Company,Unknown
"Figueroa, Cruz and Green",FishingCompany,Fishing and other related activities
"Figueroa, Mcpherson and Howard",Company,"Machine tools, including accessories and spare parts"
Figueroa-Blair,Company,Unknown
Figueroa-Stanley,Company,Unknown
Figueroa-Wise,Company,Feeder tubes; orifice rings; refractory plungers; rotor segments; feeder compositions; high speed squeeze tester; triple inspection machine; drive systems; anti-dither optical line; by-pass conveyor; metering spout; flex pressure system
Finley and Sons,Company,"Industrial fabrics (tarpaulin, truck canvas, resin container and inflatables); Design and installation of architectural structure"
Finley Ltd,Company,Unknown
Finley-Wiley,Company,Unknown
Fischer Group,Company,Unknown
Fischer Inc,Company,Fabrics and apparel products
Fischer Ltd,Company,Unknown
Fischer PLC,Company,Unknown
"Fischer, Anderson and Obrien",Company,"Adhesives, sealants, adhesive paste and additives for the building sector, trade and tiling accessories"
"Fischer, Bray and Maddox",Company,Unknown
"Fischer, Durham and Miller",Company,Unknown
"Fischer, Graham and Robinson",FishingCompany,Fishing and other related activities
"Fischer, Jackson and Reese",Company,Unknown
"Fischer, Johnson and Orr",Company,Unknown
"Fischer, Mason and Perry",Company,Unknown
"Fischer, Price and Bradshaw",Company,Art materials; Toys; Stationery products
Fischer-Castillo,Company,Unknown
Fischer-Chung,Company,Unknown
Fischer-Cowan,Company,Unknown
Fischer-Powell,Company,Unknown
Fisher and Sons,Company,Unknown
Fisher Inc,Company,Unknown
Fisher LLC,Company,Unknown
Fisher PLC,Company,"Entrusted procurement and sale of aircraft, aircraft components, airport facility equipment, uniforms, duty-free products and in-flight goods, as well as the aircraft leasing business for training purpose"
"Fisher, Cannon and Gray",Company,Unknown
"Fisher, Cochran and Reilly",Company,Unknown
"Fisher, Jacobs and Woods",Company,Unknown
"Fisher, Mills and Sosa",Company,"Fish and fish products (fresh and frozen seafood and other aquatic products, and canned and cured fish and seafood)"
"Fisher, Mueller and Mitchell",Company,Extendospheres; Solid Ceramic Spheres - Solospheres; Synthetic Spheres; Extendospheres HB-Series Hollow Spheres; and XOL Series Spheres
"Fisher, Perez and Pham",Company,"Specialises in a wide selection of packaged frozen food, dairy products, poultry products, fish and seafood, meat products, and fresh fruits and vegetables, and other dry goods; Offers coffee and tea, mineral water and soft drink; Covers cereals, spices, canned fruits, vegetables, mushrooms and sea salt; cocoa, chocolate, and confectionary products; and fruit and vegetable juice"
"Fisher, Wong and Jimenez",Company,Unknown
"Fisher, Woods and Kirby",Company,Unknown
Fisher-Edwards,Company,Unknown
Fisher-Gomez,Company,Unknown
Fisher-Mack,Company,Unknown
Fisherman's Best N.V. Express,Company,Unknown
Fisher-Marsh,Company,Unknown
Fisher-Rivera,Company,Unknown
Fitzgerald LLC,FishingCompany,"Fresh and processed meats (beef, lamb, pork, veal, poultry, and seafood)"
Fitzgerald-Allen,Company,"Electrical steel laminations and stacks for electric machines, carbide lamination dies, die-casting moulds, and alternator stator cores"
Fitzgerald-Brewer,Company,Woven and webbing promotional products
Fitzgerald-Robertson,Company,Unknown
Fitzgerald-Snyder,Company,General merchandise and other related consumer products
Fitzpatrick Group,Company,Unknown
Fitzpatrick Ltd,Company,Unknown
"Fitzpatrick, Harris and Burton",Company,Unknown
"Fitzpatrick, Harris and Wolf",Company,Unknown
Fleming Inc,Company,"Hot and cold chamber machines, die casting dies and automation equipment"
Fleming Ltd,Company,Unknown
"Fleming, Freeman and Ramos",Company,Unknown
"Fleming, Jones and Harvey",FishingCompany,Seafood products
"Fleming, Mcdonald and Lee",Company,"Footwear (career footwear, tailored shoes, sandals, athletic shoes, outdoor footwear, casual daywear, weekend casual, casual booties, tall-shafted boots, dress shoes, special occasion shoes, and dress booties)"
Fleming-Diaz,Company,Unknown
Fleming-Hess,FishingCompany,Seafood and vegetables
Fleming-Jones,Company,"Footwear for men, women, and children"
Fleming-Martinez,Company,Unknown
Fleming-Russell,Company,Unknown
"Fletcher, Martin and Padilla",Company,Leather cases and bags as well as other fashion apparels
Fletcher-Garcia,Company,Metal stampings
Fletcher-Nelson,Company,"Specialized in processing soya sauce, bean paste, and hot bean paste"
Fletcher-Price,Company,Unknown
Fletcher-Robertson,Company,"Cosmetic, personal care, hand and face care, baby care, and cleaning products"
Flint Ltd. Liability Co &,FishingCompany,Commercial fishing
Flores and Sons,Company,"Tuna, Tuna Light, Bonito-Specialties-Isabel Salads, and Prepared Dishes"
Flores Group,Company,Unknown
Flores Inc,Company,Unknown
Flores LLC,Company,Unknown
Flores Ltd,FishingCompany,"Fresh pork and lamb meat; Smoked and cured meats, seafood, sausage, custom-cut meats, as well as specialty meat such as venison, and frozen portion-controlled products"
Flores PLC,Company,Unknown
"Flores, Crawford and Davis",Company,Beef and beef by-products
"Flores, Johnson and Alexander",Company,Unknown
"Flores, Johnson and Montes",Company,Unknown
"Flores, Miller and Harrell",Company,Unknown
"Flores, Olson and Brown",FishingCompany,"Fresh and frozen seafood, shellfish, and exotic fish"
"Flores, Peterson and Williams",Company,Unknown
"Flores, Robinson and Jimenez",Company,"Offers a wide range of products that include industrial cleaners, paint booth chemistry products, pre-treatments, food and dairy products, metalworking lubricants and coolants, specialty chemicals, pulp and paper chemicals, plastics, janitorial products, water treatment chemicals and other related products"
"Flores, Shaw and Barker",Company,Unknown
"Flores, Taylor and Nicholson",FishingCompany,"Canning, processing and manufacturing of seafood and other aquatic products"
Flores-Adams,Company,Unknown
Flores-Brown,Company,Unknown
Flores-Chapman,LogisticsCompany,"Specialises in the wholesale distribution of piece goods, fabrics, knitting yarns, thread and other notions, and accessories; Offers the preparation, weaving, knitting, finishing, and fabrication of fabric products; Encompass basic alterations, hemming, taking in or letting out, as well as lengthening and shortening services"
Flores-Cox,Company,Unknown
Flores-Grant,Company,Special coatings and paints
Flores-Moreno,Company,Unknown
Flores-Reynolds,Company,"Fishes, clams, crabs, lobsters, mussels, oysters, sea urchins, shrimp and other related marine products"
Flores-Wallace,FishingCompany,"Meat, poultry and seafood products"
Flores-White,FishingCompany,"Injection, marinades, and dips for better color, yields and shelf-life in beef, pork, poultry, and seafood [source: freelance researcher]"
Flowers and Sons,Company,Specialty chemicals
Flowers PLC,Company,Unknown
"Flowers, Berry and Ramirez",Company,Unknown
"Flowers, Bowers and Berger",Company,Unknown
"Flowers, Marshall and Miller",Company,Unknown
"Flowers, Williams and Taylor",Company,Unknown
Flowers-Austin,Company,Unknown
Flowers-Rivera,Company,Unknown
Floyd LLC,Company,Unknown
"Floyd, Boyd and Browning",Company,"Development, design and production of dated goods and stationery products, including wall calendars and planners"
Floyd-Cantu,FishingCompany,Seafood and other aquatic products
Floyd-Conner,Company,Ladies casual sleeper; designer flat footwear; ladies casual slipper
Floyd-Kelly,Company,Unknown
Floyd-Yang,Company,Unknown
Flynn LLC,FishingCompany,Finest frozen seafood
"Flynn, Garcia and Gilmore",Company,Unknown
"Flynn, Taylor and Roberts",Company,Cast and fabricated iron and steel products
Foley Inc,Company,Unknown
"Foley, Beck and Richards",Company,Unknown
"Foley, Carter and Brown",Company,Unknown
"Foley, Gordon and Bailey",Company,Unknown
"Foley, Ibarra and Daniel",Company,Unknown
Foley-Martinez,Company,Engines and turbines
Foley-Miranda,FishingCompany,"Frozen seafood products (breaded and battered, cooked vannamei shrimp, dim sum, and raw vannamei shrimp)"
Forbes-Cortez,Company,Unknown
Ford and Sons,Company,Corrosion resistant products
Ford Group,LogisticsCompany,Freight and cargo arrangement services
Ford Ltd,Company,Unknown
Ford PLC,Company,"Customs jewelry on-line inspection, Office Production Engineering, Sourcing, etc, On-line Inspection of Metal products, Merchandising, Sales & Marketing, Inspection, Quality Control, Quality Control and Inspection"
"Ford, Armstrong and Carroll",Company,Renewable energy; solar energy equipment
"Ford, Bruce and Hansen",Company,Unknown
"Ford, Jordan and Garcia",Company,Unknown
"Ford, Manning and Snyder",Company,Unknown
"Ford, Martinez and Bishop",Company,Unknown
"Ford, Parsons and Garcia",Company,"An extensive range of canned tuna, frozen tuna loins and other related canned fish products"
"Ford, Randall and Spence",Company,Carpets and rugs
"Ford, Ryan and Guerrero",Company,Unknown
"Ford, Stevens and Sharp",LogisticsCompany,"Logistics services (transports LTL freight, such as pallets, crates, entire machines, or components; consolidated freight; and partial and full truck loads; food, air and sea, chemicals, do-it-yourself, cargo, business-to-consumer, information, contract, and project logistics, as well as foreign trade compliance and warehousing services)"
Ford-Brown,Company,Of frozen Asian food delicacies
Ford-Chavez,LogisticsCompany,"General freight trucking services (buyers' consolidation, multi-countries consolidation, DC bypass, regional distribution center, freight and PO/vendor management, vendor managed inventory, direct store delivery, quality inspection, customs brokerage, return material authorization, and last minute customization; and international freight forwarding services comprise sea and air freight, break bulk, container freight station, LCL and FCL, garment-on-hangers, and customs brokerage; records management services, including document and media storage, digital imaging, Web ordering and tracking, confidential document disposal, and on-site viewing; and transportation, distribution, trading, merchandising, and tank solution)"
Ford-Gonzales,Company,Unknown
Ford-Morgan,FishingCompany,Fish and seafood products
Ford-Nolan,Company,Unknown
Ford-Williams,Company,Unknown
Foster and Sons,Company,Manufacture and sale of complete passenger automobiles
Foster Group,Company,"Adhesives, sealants, primers, cleaners and liquid coatings"
Foster Inc,Company,Safety critical services
Foster LLC,FishingCompany,Fish and seafood products
"Foster, Ayers and Casey",Company,Unknown
"Foster, Montgomery and Alexander",LogisticsCompany,"Specializes in the design and development of fashion-forward footwear, apparel, and handbags/accessories to its customers across the globe; Has decades of manufacturing experience and has excelled in every category of the footwear industry; Responsible for designing and producing a widespread assortment of fashion-forward footwear from women, kids, and men's for brands and private labels; Focuses on the core products comprising best sellers' styles year-round, along with a wide variety of fashion prevailing trends has allowed it to capitalize the market; Global reputation and presence in the international market derive from its ability to balance the dynamics of market trends with its strong fashion design principles; Manages all aspects of design; production, operations and distribution in-house so it can maintain the exclusivity of its designs and provide the best possible service to its customers"
"Foster, Underwood and Guerra",Company,Unknown
"Foster, Williams and White",Company,Unknown
Foster-Craig,Company,Unknown
Foster-Day,Company,Unknown
Foster-Hernandez,FishingCompany,"Preparing fresh and raw or cooked frozen fish and other seafoods and seafood preparations, such as soups, stews, chowders, fishcakes, crab cakes, and shrimp cakes"
Foster-Johnson,Company,"Ski and snowboard service machines/equipment, including automated, base repair and grinding, edge grinding, waxing, binding adjustment, and racing service machines; offers ski and board tuning services; provides rental software, storage and drying systems, depot and locker systems, and shop furniture; and provides accessories and spare parts, such as tuning tools, workshop accessories, tuning for feet, boot fitting, machine and rental system accessories, and storage and drying tools"
Foster-Parker,Company,Unknown
Foster-Sanchez,FishingCompany,"Related smoked, pickled and frozen seafood [source: freelance researcher]"
Foster-Smith,Company,Custom frozen and fresh food
Foster-Vasquez,Company,"Peeled tomatoes, cherry tomatoes, pulp tomatoes, bottled pulp tomatoes, and yellow tomatoes"
Foster-Williams,Company,"Piece goods, notions, and other dry goods"
Fowler and Sons,FishingCompany,Processing and preserving of fish and other seafood
Fowler Inc,Company,Food preparations
"Fowler, Andrews and Rodriguez",Company,Unknown
"Fowler, Walker and King",FishingCompany,Fresh and frozen seafood
"Fowler, Wood and Waters",Company,Food and household merchandise
Fowler-Kelly,Company,Unknown
Fowler-Lopez,Company,Unknown
Fowler-Smith,Company,"Dried fruits, fruit preserves, purees, concentrates and juices"
Fowler-Torres,Company,Unknown
Fowler-Wong,Company,"Equipment for mineral processing, aggregate processing, pulp and paper, and agricultural industries"
Fox and Sons,Company,Unknown
Fox Ltd,Company,Unknown
Fox PLC,Company,"MAN diesel and gas engines, turbomachinery and after-sales service support"
"Fox, Anderson and Nguyen",LogisticsCompany,Logistics services
"Fox, Chapman and Stone",Company,"Fish and seafood products (tuna, salmon, herring, shellfish, and groundfish products; and flounder fillets, cornmeal pollock strips, burger, tuna steak, frozen halibut steaks, as well as canned sockeye salmon and frozen sockeye, and crabs)"
"Fox, Simpson and Diaz",Company,Unknown
"Fox, Stout and Anderson",Company,Unknown
Fox-Alvarado,Company,Unknown
Fox-Garcia,Company,Unknown
Fox-Griffith,Company,Unknown
Fox-Lopez,FishingCompany,Produce and seafood products
Fox-Payne,Company,Clothing and footwear products
Fox-Smith,Company,Unknown
Fox-Williams,Company,Unknown
Francis and Sons,Company,Gelatine
Francis Group,LogisticsCompany,Sea and coastal water transportation and other related shipping activities
Francis Ltd,Company,Unknown
Francis PLC,Company,Unknown
"Francis, Fritz and Gutierrez",Company,Unknown
"Francis, Lewis and Carter",Company,Unknown
Francis-Allen,Company,Unknown
Francis-Lewis,Company,Unknown
Francis-Mann,Company,Unknown
Francis-Smith,Company,Unknown
Francis-Yoder,Company,Unknown
"Franco, Olson and Long",FishingCompany,Fresh frozen seafood; frozen value added seafood; pork and poultry products
Franco-Stuart,FishingCompany,Seafood and other aquatic products
Frank Group,FishingCompany,"Preparation and packaging seafoods (Gathering and canning seafood, smoking, salting, and drying seafood, eviscerating fresh fish by removing heads, fins, scales, bones, and entrails, shucking and packing fresh shellfish, processing marine fats and oils and freezing seafood)"
"Frank, Brown and Sexton",Company,"Variety of goods, grocery merchandise and other related basic products (apparel, and home furnishings; and selected additional items, such as paint, hardware, toiletries, cosmetics, photographic equipment, jewelry, sporting goods, watches, clocks, optical goods, stationery, gifts, household items, beddings, home accessories, furniture, home and personal electrical appliances, electronic goods, healthcare equipment, and audio and video systems)"
"Frank, Dyer and Duran",Company,Unknown
"Frank, Holland and Ferguson",Company,Fish products
"Frank, Reyes and Roman",Company,Unknown
Frank-Blackburn,Company,Unknown
Frank-Edwards,Company,Unknown
Frank-Garcia,Company,Unknown
Franklin Group,Company,Unknown
Franklin LLC,Company,Unknown
"Franklin, Gray and Sutton",Company,"Manufacture of nonprecious and precious plated metal cutlery and flatware; the manufacture of nonpowered hand and edge tools; the manufacture of nonpowered handsaws; and the manufacture of saw blades, all types (including those for sawing machines); Metal kitchen utensils (except cutting-type) and pots and pans, such as cast iron skillets"
"Franklin, Gray and Wilson",Company,Management activities of a holding company
"Franklin, Mann and White",Company,Unknown
"Franklin, Owens and Taylor",Company,Unknown
"Franklin, Perez and Brown",Company,Unknown
Franklin-King,LogisticsCompany,General freight trucking services
Frazier and Sons,Company,Unknown
Frazier Group,Company,Unknown
Frazier PLC,Company,Unknown
"Frazier, Atkinson and Cook",Company,Unknown
"Frazier, King and King",Company,Unknown
"Frazier, Ramos and Hughes",Company,"Foods such as eggs, poultry, breads and bakery products, health foods, spices, and herbs; beverages, such as wine, beer, liquor, ale, vodka, low alcohol beer and non-alcoholic beverages (cola, iced tea, lemonade, fruit punch, cappuccino, and coffee); confections and candies, and cosmetics. Moreover, the company also offers other consumer products, such as bulk dried foods, canned goods, dried cereals, car-care products, baby foods and baby-care products, breads and bakery products, books, newspapers, and cigarettes and other tobacco products"
"Frazier, Todd and Spencer",Company,Unknown
"Frazier, Wong and Miles",Company,Less than-container load and full-container load import and export services
Frazier-Arellano,Company,Unknown
Frazier-Garcia,Company,Aquatic animals and plants
Frazier-Jackson,LogisticsCompany,"Handles domestic air and trucking services, and international air and ocean cargo for imports as well as exports; Turnkey logistics solutions, such as: packaging, crating, warehousing as well as web-based inventory management, booking, tracking and tracing"
"Frederick, Coleman and Foley",Company,Unknown
"Frederick, Porter and Ross",FishingCompany,"Fishing and drying of cod fish, coastal trawling; Foodstuffs"
Frederick-Christian,Company,Unknown
Frederick-Kennedy,Company,Unknown
Frederick-Logan,Company,"Casting grain-material, sheet-material, sheet-pattern, solder filled wire-material, solder flush sheet-material, solder flush wire-material, solder paste, solder powder, tubing-material, tubing shapes, wire-material, and wire-fancy"
Freeman and Sons,Company,Die-casting of zinc alloys
Freeman Group,Company,Specialty food products
Freeman Inc,Company,Concept Studies; System Development; PKO Studies; Sounds Design / Phycho Acoustics; Energy Management; Calculation Simulation; Material Characterization; and Statistic Analysis
Freeman LLC,Company,Aquatic products
"Freeman, Holloway and Ramsey",Company,Unknown
"Freeman, Lopez and Reed",Company,Of Icelandic fish products
"Freeman, Morgan and Miller",Company,Unknown
"Freeman, Obrien and Cunningham",Company,Unknown
"Freeman, Simpson and Bowers",Company,Unknown
"Freeman, Thomas and Ward",LogisticsCompany,"Shipping, freight handling, road freight handling and warehousing services"
Freeman-Bradley,Company,"Aluminum die castings, lead die castings, brass die castings, bronze die castings, ferrous alloy die castings"
Freeman-Christensen,Company,Unknown
Freeman-Lynn,Company,"Offers a wide range of olefins, including ethylene and propylene, C4 fraction, and cracked fuel; organic chemicals, such as vinyl acetate monomer, ethyl acetate, and ester resins, as well as acetaldehyde, acetic acid, and allyl alcohol"
Freeman-Ramirez,Company,Unknown
Freeman-Wagner,Company,Sound solutions
Freeman-Williamson,Company,Unknown
Freeman-Yang,Company,Unknown
French and Sons,LogisticsCompany,"Specialises in the wholesale distribution of piece goods, fabrics, knitting yarns, thread and other notions, and hair accessories; Provides preparation of fibers, weaving of fabric, knitting of fabric, fabric finishing, and fabricating fabric products as well as offers basic alterations, such as hemming, taking in or letting out of fabrics, as well as lengthening or shortening services"
French Group,FishingCompany,Commercial fishing activities
French Ltd,FishingCompany,Fish and seafoods products
"French, Burns and Nguyen",Company,"Seals and gaskets, packing devices, hoses and tubes, coated fabrics, O-rings, and rolls and sleeves, and other related products"
French-Johnson,Company,"Steel reduction technology, steelmaking, secondary metallurgy, continuous casting, CSP technology, hot rolling mills, steckel mills, tube and pipe, long products, cold rolling mills, process lines, furnace technology, electrics and automation, environmental technology, and ecoplants"
French-Thompson,Company,"Standard floors, modulate floors or inlaid floors; inlaid wall claddings, backlit wall claddings and standard open book wall claddings; inlaid or plain marble borders; staircases of any complexity; bathrooms and kitchen of any complexity; hotel and boutique logo; fireplaces; columns; tables; outdoor floorings and pavings; cut to size floorings and pavings for interiors, outdoor and pools; artistic mosaic; outdoor seats; and design objects; Floor coverings"
Frey Inc,FishingCompany,Seafoods and vegetables as well as fruits
"Frey, Mann and Sullivan",Company,Unknown
"Frey, Robinson and Bernard",Company,Unknown
Frey-Cook,Company,Unknown
Frey-Diaz,Company,Unknown
Friedman PLC,Company,Unknown
"Friedman, Gibson and Garcia",Company,"Grocery products (Canned and frozen foods, milk, fresh fruits and vegetables, fresh and prepared meats, fish, poultry and poultry products); Other household products (alcohol, household cleaning products, medicine, and clothes)"
"Friedman, Grant and Ferguson",FishingCompany,Atlantic salmon and Rainbow trout
Friedman-Becker,Company,Pharmaceuticals and medicines
Friedman-Olson,LogisticsCompany,"Insoles for shoes, as well as the wholesale trade and distribution of shoe accessories"
Frost and Sons,Company,Brushes and hair and beauty care accessories
"Frost, Brooks and Martin",Company,Unknown
"Frost, Young and Jones",Company,Unknown
Frost-Powell,Company,"Intermediates, such as dye-intermediates, fast bases, pharmaceuticals intermediates, and agro intermediates; agrochemical, including pesticides, herbicides and fungicides; and pharmaceuticals, such as bulk drugs and formulations; Ethyl formate, methyl formate, formic acid (99 percent minimum), aluminium chloride hexahydrate, chloral, 3-nitrophthalonitrile, chloroacetylechloride, and 3-nitrophthalic acid"
Fry Ltd,FishingCompany,Seafood
"Fry, Hayes and Olsen",Company,Canned food plant based on two lines: line of tomato products in cans and glass bottles; and cooked legumes (beans and more) made from dry raw material
Fry-Bates,Company,Unknown
Frye Inc,Company,Consumer goods
Frye Ltd,Company,Unknown
"Frye, Sexton and Mann",LogisticsCompany,"Wholesale distribution of piece goods, fabrics, knitting yarns, thread and other notions, and hair accessories"
Fry-Sanchez,Company,"Together with its subsidiaries (development, production, treatment, processing and marketing of special glasses, crystals, opto-mechanical and electronic devices)"
Fuentes Group,Company,Unknown
Fuentes Inc,Company,"Household-type electrical appliances, room air-conditioners, gas and electric clothes dryers, and/or household-type audio or video equipment"
Fuentes LLC,Company,Fabricated metal products
Fuentes PLC,Company,Unknown
"Fuentes, Brown and Campbell",Company,Unknown
"Fuentes, Martinez and Porter",FishingCompany,"Deep-sea tuna longline fishing, deep-sea and coastal purse seiner fishing, crab fishing, bottom longline fishing and slern trawl fishing, tuna farming, manufacturing and trading of dehydrated food and various type of seasonings, and import and export of marine products"
Fuentes-Frank,Company,Unknown
Fuller Inc,FishingCompany,Fishing and marine farming business
Fuller PLC,Company,Unknown
"Fuller, Bradshaw and Graves",Company,Chemicals and allied products
"Fuller, Hudson and Garcia",Company,Unknown
"Fuller, Jennings and Allen",Company,Unknown
"Fuller, Miller and Moore",Company,Unknown
"Fuller, Miranda and Graham",Company,Unknown
Fuller-Harris,Company,Unknown
"Gaines, Brooks and Fowler",Company,Unknown
Gaines-Adams,Company,Electronic components and systems for automotive interiors
Gaines-Hawkins,Company,Plastic materials and resins
Gaines-Hudson,Company,Promotional products
Gallagher-Compton,Company,Unknown
Gallagher-Johnson,Company,Unknown
Gallegos and Sons,LogisticsCompany,Logistics and transportation services
