name,type,ProductServices
"Lewis, Clark and Sanders",Company,"Inorganics, Chlor-alkali and PVC. Inorganics include animal feed and fertilizers for use in dry areas and for highly sensitive crops such as vegetables, fruit, flowers and tobacco; Fine Chemicals, Gelatin and Natural Derivatives which include organic chlorine derivatives that are used in industrial chemicals, pharmaceuticals and agrochemicals"
"Lewis, Gregory and Johnson",Company,Unknown
"Lewis, Hoffman and Vang",Company,"Automation, testing, mold making, plastics technology, RFID systems and laser technology"
"Lewis, Lang and Johnson",Company,Unknown
"Lewis, Montgomery and Robinson",Company,Unknown
"Lewis, Phillips and Anderson",Company,"Pharmaceutical softgels, dietaty supplement softgels, ointment and cream, and cephalosporin antibiotics"
"Lewis, Rosales and Ortiz",FishingCompany,"Specialises in processing and wholesaling frozen seafood products, such as lobster meat, split blanched lobster, whole cooked lobster, whole raw lobster, split lobster tail, lobster tails and scored claw and arm"
"Lewis, Watson and Cordova",Company,"Industrial and household adhesives, glues, caulking compounds, sealants, and linoleum, tile, and rubber cements from vegetable, animal, or synthetic plastics materials"
Lewis-Anderson,Company,Unknown
Lewis-Ball,Company,Produces models and moulds and operates as a subcontractor of both laminate elements and complete boats
Lewis-Carlson,Company,Unknown
Lewis-Castro,Company,"Collector's plate, figurines, ornament, dolls, collectible gifts and toys, and accessories for major marketers"
Lewis-Collins,Company,Unknown
Lewis-Cook,Company,Plastic products
Lewis-Dennis,FishingCompany,Commercial fishing of finfishes from their natural habitat
Lewis-Fuentes,Company,Unknown
Lewis-Hayes,Company,Unknown
Lewis-Herrera,FishingCompany,"Canning, processing and manufacturing of seafood and other aquatic products"
Lewis-Hill,Company,Unknown
Lewis-Johnson,Company,Unknown
Lewis-Lee,Company,Steel products for the agricultural and automotive exhaust markets
Lewis-Martin,Company,Unknown
Lewis-Miller,Company,Unknown
Lewis-Morris,Company,Unknown
Lewis-Watson,Company,Unknown
Lewis-Wells,Company,"A full line of groceries, and most have pharmacies, video rental outlets, in-store banking, and florist shops"
Li and Sons,Company,Unknown
"Li, Jensen and Vazquez",Company,Unknown
"Li, Mason and Jacobson",Company,Unknown
"Li, Wright and Jones",Company,Unknown
Li-Fuller,Company,"Chemicals, plastics materials and basic forms and shapes, and other related products"
Li-Gonzalez,LogisticsCompany,Freight forwarding and global logistics services
Li-Hernandez,Company,"Hand wheels, instrument cases and covers for industrial or electronic applications, soft touch knobs and handles, plastic components for lighting and lawn and garden"
Lin LLC,Company,Unknown
"Lindsey, Byrd and Foster",Company,Unknown
"Lindsey, Mccormick and Hensley",Company,Unknown
"Lindsey, Turner and Cole",Company,Unknown
Lindsey-Little,Company,Unknown
Lindsey-Nunez,Company,"High pressure casting machines, sanitaryware, tableware and technical ceramics"
Lindsey-Shaw,Company,Wire braided products and associate components
Lin-Malone,Company,Unknown
Lin-Wilson,Company,Unknown
Li-Rodriguez,Company,"Process technologies, equipment, plants, and systems"
Little Group,Company,Unknown
Little Ltd,Company,"Industrial and semi-industrial rough-terrain masted forklift-trucks; high capacity rough-terrain and rotating, telescopic forklift-trucks; compact loaders; truck-mounted forklifts; vertical, articulated, scissor and telescopic access platforms; forklift-trucks with front telescopic arm and a rear-mounted shovel; and warehouse equipment, including pallet forklift-trucks and stackers"
"Little, Macias and Reyes",Company,Unknown
"Little, Mills and West",Company,Authentic Italian olive oils
Little-Decker,Company,Electronic manufacturing services
Little-Miller,Company,Unknown
Little-Murphy,Company,Unknown
"Liu, Sanchez and Robbins",Company,Apparel
Liu-Dawson,Company,"Pre-press (CTP and film output capabilities, digital and traditional proofs); press (web and sheet-fed printing, web in-line finishing); and post press (saddle-stitching and perfect binding, packaging - shrink wrapping or poly-bragging, wire-O spiral binding)"
Livingston and Sons,Company,"Range of furniture, home decor and gifts"
Livingston Group,Company,"Staple gun tackers, electric staples, wiring tacker guns, hammer tackers, plier type staplers, rivet tools, glue guns, brute tapes, desk staplers, specialty staples, retired tools, accessory products (batteries, battery chargers, electric nail set, combo wires, parts kits, and others)"
Livingston PLC,Company,"New Home and Storage items, advertisements and compile aggregate data about site traffic and site [source: freelance researcher]"
Livingston-Gutierrez,Company,Unknown
Livingston-Johnson,Company,"Automatic transmission parts and components, as well as electronic parts, mainly for cars"
Livingston-Solomon,Company,Unknown
Li-Webster,Company,"Gelatin, collagen, and flavored gelatin"
Lloyd Inc,LogisticsCompany,Unknown
Lloyd-Estes,FishingCompany,"Seafood product preparation and packaging such transforming food into other forms for consumption; Canning seafood, smoking, salting, and drying seafood, eviscerating fresh fish by removing heads, fins, scales, bones, and entrails, shucking and packing fresh shellfish, processing marine fats and oils and freezing seafood"
Lloyd-Lopez,Company,"Specializes in processing new or spent (i.e., recycled) plastics resins into intermediate or final products, using such processes as compression molding, extrusion molding, and injection molding, as well as blow molding and casting"
Lloyd-Sandoval,Company,"Luxury vinyl flooring, premium laminate and accessories"
Lloyd-Wood,Company,"Offers a range of stationery products including writing instruments such as gel ink pen, ball pen, ball pen refill, gel ink pen refill, roller pen, mechanical pencil, mechanical lead pencil, and wooden pencil; and art materials such as oil pastel, crayon, water color marker, color pencil, color dough, paint brush, sketching tools, drawing pigment, and drawing set; Office supplies such as white board market, highlighter pen, and permanent marker; and school supplies such as stationary case, pencil bag, eraser, ruler, compass, glue, scissors, and sharpeners"
"Logan, Brooks and Young",Company,A range of food products
"Logan, Grimes and Barajas",Company,Braiding machines and auxiliary machinery
"Logan, Hanson and Fischer",Company,Unknown
"Logan, Marquez and Case",Company,Unknown
Logan-Dickerson,Company,Live and frozen West Coast rock lobster; Live and tailed South Coast lobster
Logan-Parrish,Company,Unknown
Logan-Rice,Company,Condiments and seasonings
Long Group,Company,Unknown
Long Inc,Company,Footwear
Long LLC,Company,"Operates as a turn-key supplier of custom fixtures, millwork and retail environments"
Long Ltd,Company,Unknown
"Long, Allen and Thompson",LogisticsCompany,Freight forwarding services
"Long, Diaz and Guzman",Company,"Involved in offering a range of high performance plastic and composites which are used in automobile parts, household electric appliances, and telecommunication industry. Its products include polypropylene series of high-performance materials, styrene copolymer material series, polycarbonate alloy series, polyamide and the thermoplastic polyester engineering plastics, liquid crystal polymer materials, modified polyolefins, modified acrylonitrile butadiene styrenes, plastic alloy products, and other products"
"Long, Leblanc and Hickman",Company,Unknown
"Long, Watkins and Gonzalez",Company,Unknown
Long-Chang,Company,Sandals
Long-Cook,Company,Unknown
Long-Hardin,Company,Unknown
Long-Hoffman,FishingCompany,"Canning, processing and manufacturing of seafood and other aquatic products"
Long-Long,Company,Apparel
Long-Santos,Company,Veneer sheets and wood-based panels
Long-Velazquez,Company,Unknown
Long-White,Company,Unknown
Lopez and Sons,Company,"Colored, Curved, Dried/Snack, Fresh, Ham and Roast Film, Large Calibre, Plastic, Processed and Smoked edible casings"
Lopez Group,Company,Leveling machines (parts levelers to high-capacity levelers for coiled materials)
Lopez Inc,Company,Unknown
Lopez LLC,Company,Embroidery machines; Assembly services
Lopez Ltd,Company,Unknown
Lopez PLC,Company,Range of knitwear and textile products
"Lopez, Austin and Buchanan",Company,"Processing and processing of fish products, such as anchovies, sardines, and produces several products derived from these raw materials"
"Lopez, Berry and Shepard",Company,Unknown
"Lopez, Bradshaw and Jacobs",Company,Swimwear and fashion clothing for women
"Lopez, Brown and Adams",Company,Unknown
"Lopez, Campbell and Wilson",Company,Unknown
"Lopez, Davis and Melton",Company,Unknown
"Lopez, Foster and Bennett",Company,Unknown
"Lopez, Grant and Humphrey",Company,Unknown
"Lopez, Gutierrez and Castro",Company,Unknown
"Lopez, Hart and Collins",Company,Unknown
"Lopez, Hayden and Moore",Company,Unknown
"Lopez, Hess and Smith",Company,Unknown
"Lopez, Johnson and Bradford",Company,"Beauty, fashion, jewelry, home, electronics, cooking and dining, collectibles, fitness, and music products"
"Lopez, Johnson and Ward",Company,Unknown
"Lopez, Jones and Weaver",Company,Salt
"Lopez, Marshall and Miller",Company,Unknown
"Lopez, Martin and Kennedy",Company,Rubber products
"Lopez, Nichols and Clarke",LogisticsCompany,Sea and coastal water transportation and other related shipping activities
"Lopez, Peck and Hayes",Company,Unknown
"Lopez, Rose and Duncan",Company,Unknown
"Lopez, Thomas and Simmons",Company,Unknown
Lopez-Blair,Company,Unknown
Lopez-Brown,Company,Unknown
Lopez-Carr,Company,Textiles and other related products
Lopez-Clark,Company,Unknown
Lopez-Collins,Company,Vitamin and supplement products
Lopez-Davis,Company,"Marketing, Seed Technology, wheat, barley, oats, OSR, beans, peas, lupins, maize and fodder beet, Cereal as a Wholecrop, Spring Barley, Spring Oats, Spring Wheat, Triticale, Winter Barley, Winter Oat, Winter Wheat, Straights, Compass, Non Plastic Varieties, Varieties Under Plastic, Oilseed Rape Varieties, Forage Rape, Kale, Stubble Turnip, Blaze, Blizzard, Protein Crops, Willow [source: freelance researcher]"
Lopez-Delgado,Company,"Fresh and frozen Alaska pollock, pcod/acod, hake, frozen arrowtooth flounder, halibut, chum salmon fillet and red fish, among others"
Lopez-Ford,Company,Canned and cured fish and seafoods
Lopez-Fritz,Company,Unknown
Lopez-Harris,FishingCompany,Seafood
Lopez-Hayes,FishingCompany,"Canning, processing and manufacturing of seafood and other aquatic products"
Lopez-Jimenez,Company,Unknown
Lopez-Johnson,Company,Unknown
Lopez-Jordan,Company,"Edible powder gelatine, leaf gelatine, emulsion gelatine, dispersion gelatine, protective layer gelatine, modified gelatine, hard/soft capsule gelatine, pharmaceutical hydrolysate, collagen hydrolysate, plant hydrolysates, and succinylated gelatine"
Lopez-Lloyd,Company,Modern state-of-the-art tool and die facility
Lopez-Mcdaniel,Company,Unknown
Lopez-Ramirez,Company,Unknown
Lopez-Salinas,Company,Unknown
Lopez-Sanders,Company,Unknown
Lopez-Warren,Company,Unknown
Love PLC,Company,Unknown
"Love, Anderson and Brown",Company,Unknown
"Love, King and Anderson",Company,Food
"Love, Williams and Murphy",Company,Unknown
"Lowe, Carter and Hull",Company,Beauty salons and spas
"Lowe, Hood and Mills",Company,Unknown
"Lowe, Klein and Ponce",Company,Unknown
"Lowe, Martinez and Smith",Company,Unknown
"Lowe, Morgan and Vega",Company,Unknown
Lowe-Cole,Company,A range of footwear products
Lowe-Harris,Company,"Dry fish, sand lobster, and sole fish"
Lowe-James,Company,Unknown
Lowery and Sons,Company,Unknown
Lowery Group,Company,Unknown
Lowery-Myers,FishingCompany,"Seafood products include Antarctic toothfish, arrow squid, barracouta, blue mackerel, gemfish, ghost shark, greenshell mussels, jack mackerel, john dory, king salmon, lemon sole, monkfish, orange roughy, patagonian toothfish, red cod, scampi, silver warehou, smooth oreo dory, snapper, and yellowbelly flounder"
Lozano Group,Company,Unknown
"Lozano, Ellis and Lopez",Company,Unknown
"Lozano, Hudson and Swanson",Company,Unknown
"Lozano, Ponce and Burnett",Company,Unknown
Lozano-Mccoy,Company,Unknown
Lucas and Sons,Company,Poultry meat
Lucas Group,Company,Unknown
Lucas PLC,Company,Unknown
"Lucas, Berry and Blake",Company,Unknown
"Lucas, Ward and Brown",Company,Unknown
Lucas-Campos,FishingCompany,Seafood products
Lucas-Potts,Company,Architectural services and engineering services
Lucero and Sons,Company,Unknown
Lucero PLC,Company,"Swordfish, blue shark, tuna, marlin, bonito, sailfish, barracuda, shortfin mako and amberjack"
"Lucero, Payne and Lucas",Company,Collagens and gelatines
"Lucero, Sanchez and Perez",Company,"Towels, blankets, robes, spa/resort gift items in the promotional industry"
"Lucero, Vaughn and Mckee",Company,"Specialises in a wide range of nondurable goods, including furniture and home furnishings; computers and peripheral equipment; electronic and optical equipment; industrial machinery and equipment; office supplies; packaging and containers; and paper and paper products; Offers other nondurable goods, such as personal products, rubber products, plastic products, textile raw materials, agricultural raw materials, clothing and footwear, and other semi finished goods"
Lucero-Barajas,Company,Unknown
Lucero-Chase,Company,Unknown
Lucero-Lee,Company,"Specialises in manufacturing dairy products from raw milk and/or processed milk products, dairy substitutes from soybeans and other nondairy substances; and dry, condensed, concentrated, and evaporated dairy and dairy substitute products; Produces milk (nonfat milk, powdered milk and fresh milk), cheese, quark, yogurt, gelatin, curd, and infant formula"
Lucero-Saunders,Company,Unknown
Luna and Sons,Company,Drinkware
Luna Group,Company,Fish and fish products
Luna LLC,Company,Unknown
"Luna, Henderson and Smith",Company,Electrical materials and systems solutions
Luna-Anderson,Company,Unknown
Luna-Bean,Company,Rusks and biscuits
Luna-James,Company,Unknown
Luna-Martinez,FishingCompany,"Specialises in manufacturing dried seafood, such as shrimp, crab shell, squid, hemigo, and anchovy"
Luna-Young,Company,Unknown
Lutz PLC,Company,Unknown
"Lutz, Johns and Clark",Company,"Manufacture and sale of canned and cured fish and seafoods, as well as other related products"
Lutz-Fleming,FishingCompany,Fish and seafood products
Lynch Group,FishingCompany,Fish and seafoods products
Lynch LLC,Company,Unknown
Lynch PLC,Company,Unknown
"Lynch, Collier and Guerra",Company,Unknown
"Lynch, Garcia and Fernandez",Company,Unknown
"Lynch, Johnson and Lawrence",Company,Plastic products
"Lynch, Murray and Fisher",Company,Unknown
"Lynch, Rodriguez and Horn",Company,Unknown
"Lynch, Rodriguez and Rivera",Company,Unknown
Lynch-Jackson,Company,Providing cold storage and freezing products services
Lynch-Patterson,LogisticsCompany,Outsourced logistics
Lynch-Suarez,Company,Furniture products
Lynn Group,Company,Unknown
"Lynn, Gentry and Collins",Company,Motor vehicle and motor vehicle parts and accessories
Lynn-Cruz,Company,Frozen sea products
Lynn-Nguyen,Company,Unknown
Lyons and Sons,Company,Feeders; booklet makers; perfect binders; collators; trimmers; accessories; and pneumatic systems
Lyons Group,Company,Unknown
Lyons Ltd,Company,Unknown
"Lyons, Garcia and Miller",Company,Trade agents and brokers
"Lyons, Hudson and Barton",Company,Unknown
"Lyons, Lane and Martin",LogisticsCompany,"Design, production and distribution of LCD (liquid crystal display) monitors, computer monitors and flat television products"
"Lyons, Nelson and Stewart",Company,Unknown
"Lyons, Villarreal and Gutierrez",Company,"Offers a wide range of processed and preserved shellfish, and exotic fish"
Lyons-Carroll,Company,"Plastic materials, synthetic resins and other related products"
Lyons-Robinson,Company,Unknown
Macdonald-Garrett,Company,Unknown
Macdonald-Phillips,Company,Holding company
Macias Group,Company,Consumable merchandise
Mack and Sons,Company,"Gelatin, collagen peptide, dicalcium phosphate (DCP), ossein, chitosan, and bovine collagen peptide"
Mack Inc,Company,"Pens, ballpoint pen refills and cartridges, mechanical pencils, and felt tipped markers"
Mack Ltd,Company,Truck and trailer equipment
"Mack, Cox and Moran",Company,Unknown
Mack-Alvarado,Company,Unknown
Mack-Carrillo,Company,"Specializes in the production of a wide variety of toys, such as construction toys, drawing toys, educational toys, executive toys, miniaturized items, model building, action figures, stuffed animals, model collecting, puzzle/assembly toys, science and optical, toy vehicles, and physical activity and dexterity toys"
Mack-Wilson,Company,Unknown
Madden and Sons,Company,"Balloons, packaging materials, storage and shelving units [source: freelance researcher]"
Madden Group,Company,Unknown
"Madden, Meza and Ramos",Company,"Belts, PE bags, leather cuff, leather belts, hanger, and hardware"
Madden-Green,Company,Unknown
Maddox Group,Company,Durable and non-durable goods
Maddox PLC,Company,Unknown
"Maddox, Bailey and Raymond",Company,Unknown
"Maddox, Jenkins and Moore",Company,"Sushi and topping, kobachi (Japanese Tapas), sashimi and sunomomo, fried and grilled foods, takowasabi coloring and appetiziers and kaya jam"
Mahoney and Sons,Company,Unknown
"Mahoney, Brown and Lee",Company,Air brake components and systems and aluminum castings for original equipment manufacturers (OEMs)
"Mahoney, Shelton and Perez",Company,Unknown
Mahoney-Martinez,Company,Unknown
"Maldonado, Mills and Smith",Company,Unknown
"Maldonado, Sanchez and Jones",Company,Unknown
Malone LLC,Company,Unknown
Malone PLC,Company,Unknown
"Malone, Warren and Johnson",Company,"Offers a wide range of jewelry collection such as rings, bracelets, charms, chains, crosses, earrings, necklaces, pins and pendants; Provides sterling silver jewelry, yellow and white gold, and gemstones; Sells through a catalog and via the Internet"
Malone-Lyons,Company,Motor vehicles and other related activities
Malone-Woods,Company,Sea food products
Mann and Sons,Company,Unknown
Mann Group,Company,Unknown
Mann LLC,Company,Fishery products
Mann PLC,Company,"Laminated plastic plates, sheets, unsupported plastic profile shapes, and unsupported plastic film or sheets"
"Mann, Johnson and Wade",Company,Unknown
"Mann, Knight and Smith",Company,Fluid milk and other related dairy products
"Mann, Myers and Rivera",FishingCompany,"Canning, processing and manufacturing of seafood and other aquatic products"
Mann-Carey,Company,Unknown
Manning and Sons,Company,Bearings and wear parts in the marine and rail industry [source: freelance researcher]
Manning Ltd,Company,Unknown
"Manning, Fritz and Brooks",Company,Unknown
"Manning, Hill and Myers",Company,Unknown
"Manning, Keller and Ferguson",Company,Unknown
"Manning, Ortega and Ruiz",Company,Unknown
Manning-Montes,FishingCompany,Fishing activities
Manning-Pratt,LogisticsCompany,General freight trucking services
Mann-Mayo,Company,Food products
Mar de la Costa BV,Company,Unknown
Mar de la Felicidad Ltd. Corporation,FishingCompany,Fishing and fish processing
Mar de la Vida Sagl,FishingCompany,"Fishing and drying of cod fish, coastal trawling; Foodstuffs"
Mar y Viento Sp Freight,Company,Unknown
Marine sanctuary Tom yum,FishingCompany,Marine fishing
Marks PLC,FishingCompany,"Processed seafood (raw and cooked black tiger shrimps and white vannamei shrimps [frozen head-on, headless shell-on, peeled/deveined, undeveined, easy peeled, frozen cooked, peeled tail-on peeled tail-off, cooked shell-on, cooked peel, cooked-peeled undeveined, cooked shrimp rings with cocktail sauce, and breaded shrimps], squid shreds, uncooked squid, dried squid, dried squid rings, cuttlefish, octopus, clams, mussels, salmon half-cut, fish skewer, sole, tuna, herring eggs, and Japanese foods [sashimi fish, tempura shrimps and squid sushi])"
"Marks, Hartman and Rodriguez",Company,Unknown
"Marks, Murphy and Ryan",Company,Unknown
Marquez Group,Company,Unknown
Marquez LLC,Company,Unknown
Marquez Ltd,Company,Unknown
Marquez PLC,Company,"Oxygen (liquefied, compressed), medical oxygen (liquid), air (compressed), nitrogen (liquefied, compressed), carbon dioxide (compressed), argon (liquefied), nitrogen hydrogen mixed gas, as well as the generated steam, sulfur, ash by-products and food additive nitrogen"
"Marquez, Jones and Garcia",Company,High sheet metals
"Marquez, Ruiz and Cook",Company,Unknown
Marquez-Johnson,Company,Unknown
Marquez-Melendez,Company,Shoes
Marquez-Nunez,Company,Unknown
Marquez-Ray,Company,"Shoes, such as misses', youths', boys', children's, and infants' footwear and athletic footwear; Sneakers, flat sandals, high heel sandals, boots, rubber shoes, casual shoes, safety footwear, military shoes, leather sandal and footwear, casual footwear, EVA flip-flops, insole, moccasins, orthopedic shoes, ballet slippers, house slippers, as well as rubber slippers, among others"
Marsh Group,Company,Unknown
"Marsh, Williams and Hunter",Company,Fruits and vegetables
Marshall and Sons,Company,Shoes and other related footwear products
Marshall LLC,Company,Unknown
Marshall Ltd,Company,Unknown
"Marshall, Johnson and Payne",Company,Unknown
"Marshall, Khan and Ford",Company,"Product Brochure, All Products, Attach, Seal, Equip, Adhesive, Seal, Glue, Product, Apply, Attach, Tape, Packaging, Fantastak, Stick, Dot, GlueDot, Fugitive Dots, Dots, International Supplier, Adhesive dots, We are a leading developer and manufacturer of glue dots, available in a range of adhesive strengths and sizes"
"Marshall, Martinez and Contreras",Company,Unknown
"Marshall, Norris and Johnson",Company,Unknown
"Marshall, Soto and Melendez",Company,Unknown
Marshall-Green,Company,Unknown
Marshall-Pennington,Company,Unknown
Marshall-Russell,LogisticsCompany,Arranging transportation of freight between shippers and carriers; Combination of services spanning transportation modes
Marsh-Klein,Company,"Food products, sporting goods, and prepaid phone cards"
Marsh-Li,Company,Unknown
Marsh-Tapia,LogisticsCompany,"Truck tie-downs for flatbed trailers, and interior vans; Auto tie-downs, nets, commodity slings, marine straps and air cargo securements; Hardware products and accessories for the trucking, maritime and airline industries"
Martin and Sons,Company,Unknown
Martin Group,Company,Unknown
Martin Inc,Company,Unknown
Martin LLC,FishingCompany,Frozen seafood
Martin Ltd,Company,Ceramic chip capacitors
Martin PLC,Company,Unknown
"Martin, Atkins and Khan",Company,Unknown
"Martin, Blankenship and Cooper",LogisticsCompany,"Freight transportation arrangement, customs brokerage, international freight forwarding and surface transportation services"
"Martin, Carter and Gray",Company,Unknown
"Martin, Davis and Huynh",Company,"Complete aluminium and steel systems, and solar products"
"Martin, Greer and Smith",Company,Footwear and other related products
"Martin, Hall and Simpson",LogisticsCompany,"Packing and crating services, freight transportation, specialized in freight forwarding and general warehousing and storage"
"Martin, Harris and Robinson",Company,Unknown
"Martin, Kennedy and Chavez",Company,Unknown
"Martin, Kidd and Hall",Company,"Smoked Norwegian salmon, Canadian wild salmon, trout, and Greenland halibut"
"Martin, Kirby and Phillips",Company,Unknown
"Martin, Lopez and Collier",FishingCompany,Seafood
"Martin, Molina and Riley",Company,Unknown
"Martin, Payne and Stewart",Company,Unknown
"Martin, Reeves and Davis",Company,Unknown
"Martin, Sanchez and Garrison",Company,Unknown
"Martin, Sanders and Murray",Company,"Personal computers; computers, peripherals & software; electronic parts & equipment, bare printed circuit boards, integrated circuit lids, sputtering targets, and photo mask"
"Martin, Scott and Hines",Company,Unknown
"Martin, Sims and Gutierrez",Company,Unknown
"Martin, Tucker and Brown",Company,Unknown
Martin-Allen,Company,Unknown
Martin-Black,Company,Unknown
Martin-Carson,FinancialCompany,"Accounting, bookkeeping, auditing and tax consultancy services"
Martin-Carter,Company,Tea and coffee
Martin-Case,FishingCompany,"Tuna, sword fish, bass, trout, and salmon, as well as offers shellfish, mollusks, crustaceans, sea vegetables, shrimp, lobster, squid, oysters, crabs, and clams, and other related seafood products"
Martinez and Sons,Company,Cell phones and small appliances
Martinez Group,Company,Unknown
Martinez Inc,Company,Logistic services
Martinez LLC,Company,Agar-Agar products
Martinez Ltd,FishingCompany,Prepared fresh or frozen fish and seafood products
Martinez PLC,Company,"Supplies printed packaging products for pharmaceutical, medical device, animal health, dietary supplements, diagnostics, and biotech industries"
"Martinez, Anderson and Rodriguez",Company,Paper and paper products
"Martinez, Brown and Mclaughlin",Company,Unknown
"Martinez, Campbell and Marsh",LogisticsCompany,Transportation and logistics services
"Martinez, Clark and Shaffer",Company,Fish and fish products
"Martinez, Davidson and Wood",Company,Unknown
"Martinez, Garcia and Carpenter",Company,Unknown
"Martinez, Garcia and Escobar",Company,Food products
"Martinez, Garcia and Wood",Company,Unknown
"Martinez, Gilmore and Martinez",Company,Unknown
"Martinez, Green and Medina",Company,Unknown
"Martinez, Gutierrez and Salinas",FishingCompany,"RAM-XTM, RAM-XTMR and RAMXCELTM; Kayaks, canoes, pedal boats and fishing boats; Winter toys, kiddie pools and sandboxes"
"Martinez, Hartman and Parsons",Company,Unknown
"Martinez, Hicks and Kelly",Company,Unknown
"Martinez, Jones and Wright",Company,"Agricultural products, flooring products, and other related products"
"Martinez, Paul and Armstrong",Company,Unknown
"Martinez, Perry and Morrison",Company,"Healthcare, disposable, and institutional products"
"Martinez, Rose and Carter",Company,Unknown
"Martinez, Santana and Logan",Company,Unknown
